number,value,datetime_start,datetime_complete,duration,params_bootstrap,params_max_depth,params_max_features,params_min_samples_leaf,params_min_samples_split,params_n_estimators,state
0,0.7785823706829227,2025-06-15 14:10:39.676029,2025-06-15 14:11:13.402118,0 days 00:00:33.726089,True,26,0.5,4,7,134,COMPLETE
1,0.7486796290726009,2025-06-15 14:10:39.679025,2025-06-15 14:11:22.261854,0 days 00:00:42.582829,False,15,log2,1,10,232,COMPLETE
2,0.6210907179261456,2025-06-15 14:10:39.681022,2025-06-15 14:11:18.450985,0 days 00:00:38.769963,False,11,log2,4,4,257,COMPLETE
3,0.7911191903262798,2025-06-15 14:10:39.682529,2025-06-15 14:11:05.423046,0 days 00:00:25.740517,True,27,0.5,1,8,102,COMPLETE
4,0.7755958897658028,2025-06-15 14:10:39.685053,2025-06-15 14:12:11.237986,0 days 00:01:31.552933,True,17,0.5,5,4,361,COMPLETE
5,0.5033941962781782,2025-06-15 14:10:39.687055,2025-06-15 14:11:24.674092,0 days 00:00:44.987037,False,5,sqrt,4,9,310,COMPLETE
6,0.7853338955205597,2025-06-15 14:10:39.689053,2025-06-15 14:11:37.287467,0 days 00:00:57.598414,False,16,0.5,5,7,251,COMPLETE
7,0.7469445081122441,2025-06-15 14:10:39.691059,2025-06-15 14:11:50.571841,0 days 00:01:10.880782,False,7,0.5,1,7,359,COMPLETE
8,0.7868827472063262,2025-06-15 14:11:05.433585,2025-06-15 14:12:19.998088,0 days 00:01:14.564503,False,17,0.5,4,6,316,COMPLETE
9,0.6716406477784995,2025-06-15 14:11:13.412071,2025-06-15 14:12:07.983426,0 days 00:00:54.571355,False,9,log2,1,8,336,COMPLETE
10,0.772086144122486,2025-06-15 14:11:18.459456,2025-06-15 14:13:11.529150,0 days 00:01:53.069694,True,21,log2,1,2,443,COMPLETE
11,0.6765070174411154,2025-06-15 14:11:22.267885,2025-06-15 14:11:53.668431,0 days 00:00:31.400546,False,16,sqrt,5,9,199,COMPLETE
12,0.5424674181070834,2025-06-15 14:11:24.682642,2025-06-15 14:12:31.075756,0 days 00:01:06.393114,True,6,log2,1,5,330,COMPLETE
13,0.5693676058816584,2025-06-15 14:11:37.293713,2025-06-15 14:13:19.541939,0 days 00:01:42.248226,True,24,log2,5,3,477,COMPLETE
14,0.7679449750747805,2025-06-15 14:11:50.581619,2025-06-15 14:13:29.955411,0 days 00:01:39.373792,False,15,sqrt,1,4,498,COMPLETE
15,0.6366889707012428,2025-06-15 14:11:53.676779,2025-06-15 14:12:24.338666,0 days 00:00:30.661887,True,19,sqrt,5,8,146,COMPLETE
16,0.7304505782201198,2025-06-15 14:12:07.989942,2025-06-15 14:12:38.387513,0 days 00:00:30.397571,False,23,sqrt,3,2,175,COMPLETE
17,0.7921718524783025,2025-06-15 14:12:11.244502,2025-06-15 14:14:18.353202,0 days 00:02:07.108700,True,29,0.5,2,5,455,COMPLETE
18,0.7926383565078048,2025-06-15 14:12:20.010101,2025-06-15 14:14:31.428482,0 days 00:02:11.418381,True,26,0.5,2,5,477,COMPLETE
19,0.7963251998594341,2025-06-15 14:12:24.343672,2025-06-15 14:14:25.448820,0 days 00:02:01.105148,True,30,0.5,2,2,432,COMPLETE
20,0.7940308528531692,2025-06-15 14:12:31.083268,2025-06-15 14:14:44.139346,0 days 00:02:13.056078,True,30,0.5,2,2,482,COMPLETE
21,0.7942101325474923,2025-06-15 14:12:38.393513,2025-06-15 14:14:31.179462,0 days 00:01:52.785949,True,30,0.5,2,5,410,COMPLETE
22,0.7899580368719319,2025-06-15 14:13:11.536163,2025-06-15 14:15:04.894206,0 days 00:01:53.358043,True,30,0.5,2,5,439,COMPLETE
23,0.7911846029213654,2025-06-15 14:13:19.550060,2025-06-15 14:15:03.723854,0 days 00:01:44.173794,True,29,0.5,2,6,408,COMPLETE
24,0.7921307964830746,2025-06-15 14:13:29.961934,2025-06-15 14:13:59.659952,0 days 00:00:29.698018,True,29,0.5,2,5,102,COMPLETE
25,0.7912288692211751,2025-06-15 14:13:59.666669,2025-06-15 14:14:27.585012,0 days 00:00:27.918343,True,30,0.5,2,6,112,COMPLETE
26,0.7934034204107325,2025-06-15 14:14:18.361718,2025-06-15 14:16:04.141055,0 days 00:01:45.779337,True,29,0.5,2,5,429,COMPLETE
27,0.7935750805903753,2025-06-15 14:14:25.455332,2025-06-15 14:16:08.630394,0 days 00:01:43.175062,True,30,0.5,2,3,413,COMPLETE
28,0.7917363010065802,2025-06-15 14:14:27.590300,2025-06-15 14:16:07.121771,0 days 00:01:39.531471,True,30,0.5,2,5,402,COMPLETE
29,0.7955114355975796,2025-06-15 14:14:31.187465,2025-06-15 14:16:15.417447,0 days 00:01:44.229982,True,28,0.5,2,3,415,COMPLETE
30,0.789116725684126,2025-06-15 14:14:31.434491,2025-06-15 14:16:10.908104,0 days 00:01:39.473613,True,26,0.5,3,3,408,COMPLETE
31,0.785674423479447,2025-06-15 14:14:44.144344,2025-06-15 14:16:25.256758,0 days 00:01:41.112414,True,28,0.5,3,3,410,COMPLETE
32,0.7887631267187043,2025-06-15 14:15:03.732856,2025-06-15 14:16:46.918987,0 days 00:01:43.186131,True,27,0.5,3,3,412,COMPLETE
33,0.7866201948805951,2025-06-15 14:15:04.901733,2025-06-15 14:16:45.331919,0 days 00:01:40.430186,True,24,0.5,3,3,402,COMPLETE
34,0.7861522738903226,2025-06-15 14:16:04.146925,2025-06-15 14:17:43.301210,0 days 00:01:39.154285,True,24,0.5,3,3,386,COMPLETE
35,0.7869965746702302,2025-06-15 14:16:07.136027,2025-06-15 14:17:45.419500,0 days 00:01:38.283473,True,24,0.5,3,3,389,COMPLETE
36,0.7849628175124534,2025-06-15 14:16:08.635392,2025-06-15 14:17:47.062679,0 days 00:01:38.427287,True,26,0.5,3,3,388,COMPLETE
37,0.7868168104532037,2025-06-15 14:16:10.915534,2025-06-15 14:17:48.670452,0 days 00:01:37.754918,True,27,0.5,3,2,386,COMPLETE
38,0.7844082601587702,2025-06-15 14:16:15.422451,2025-06-15 14:17:52.991071,0 days 00:01:37.568620,True,27,0.5,3,2,384,COMPLETE
39,0.7840114868529086,2025-06-15 14:16:25.262391,2025-06-15 14:17:59.135141,0 days 00:01:33.872750,True,25,0.5,3,2,368,COMPLETE
40,0.786032688465871,2025-06-15 14:16:45.338146,2025-06-15 14:18:51.908218,0 days 00:02:06.570072,True,27,0.5,3,2,499,COMPLETE
41,0.7886866760618514,2025-06-15 14:16:46.925739,2025-06-15 14:18:53.457039,0 days 00:02:06.531300,True,25,0.5,3,2,498,COMPLETE
42,0.7925805874447178,2025-06-15 14:17:43.306959,2025-06-15 14:19:20.912115,0 days 00:01:37.605156,True,26,0.5,2,2,372,COMPLETE
43,0.7959930048555028,2025-06-15 14:17:45.429012,2025-06-15 14:19:46.619489,0 days 00:02:01.190477,True,27,0.5,2,2,463,COMPLETE
44,0.796065201922059,2025-06-15 14:17:47.067813,2025-06-15 14:19:48.330433,0 days 00:02:01.262620,True,27,0.5,2,2,463,COMPLETE
45,0.7949585166621507,2025-06-15 14:17:48.678563,2025-06-15 14:19:05.188391,0 days 00:01:16.509828,True,22,0.5,2,2,289,COMPLETE
46,0.6920440024404366,2025-06-15 14:17:52.997791,2025-06-15 14:19:30.552167,0 days 00:01:37.554376,True,13,log2,2,4,464,COMPLETE
47,0.6952821072802762,2025-06-15 14:17:59.139666,2025-06-15 14:19:36.012840,0 days 00:01:36.873174,True,13,log2,2,4,464,COMPLETE
48,0.7960323488383719,2025-06-15 14:18:51.920124,2025-06-15 14:20:56.173038,0 days 00:02:04.252914,True,28,0.5,2,4,462,COMPLETE
49,0.7940885616126854,2025-06-15 14:18:53.466523,2025-06-15 14:20:09.494327,0 days 00:01:16.027804,True,28,0.5,2,4,284,COMPLETE
50,0.716246844121728,2025-06-15 14:19:05.192042,2025-06-15 14:20:07.515597,0 days 00:01:02.323555,True,21,log2,2,4,283,COMPLETE
51,0.7695157423200865,2025-06-15 14:19:20.916619,2025-06-15 14:20:31.808145,0 days 00:01:10.891526,True,20,log2,1,4,286,COMPLETE
52,0.7998543835415541,2025-06-15 14:19:30.557680,2025-06-15 14:20:46.815752,0 days 00:01:16.258072,True,28,0.5,1,4,274,COMPLETE
53,0.7781310566221381,2025-06-15 14:19:36.020359,2025-06-15 14:20:37.282393,0 days 00:01:01.262034,False,21,sqrt,1,4,288,COMPLETE
54,0.7786005946489666,2025-06-15 14:19:46.621490,2025-06-15 14:20:45.585372,0 days 00:00:58.963882,False,20,sqrt,1,4,278,COMPLETE
55,0.7800534625535207,2025-06-15 14:19:48.333834,2025-06-15 14:20:46.292147,0 days 00:00:57.958313,False,22,sqrt,1,2,265,COMPLETE
56,0.7812617854452047,2025-06-15 14:20:07.521656,2025-06-15 14:21:04.309691,0 days 00:00:56.788035,False,22,sqrt,1,2,266,COMPLETE
57,0.7797532533954628,2025-06-15 14:20:09.496328,2025-06-15 14:20:58.634786,0 days 00:00:49.138458,False,22,sqrt,1,2,226,COMPLETE
58,0.780624431381659,2025-06-15 14:20:31.815578,2025-06-15 14:21:23.851902,0 days 00:00:52.036324,False,28,sqrt,1,2,253,COMPLETE
59,0.7980011213166712,2025-06-15 14:20:37.287671,2025-06-15 14:22:00.639732,0 days 00:01:23.352061,False,22,0.5,1,2,342,COMPLETE
60,0.7930373264243096,2025-06-15 14:20:45.590627,2025-06-15 14:21:47.894666,0 days 00:01:02.304039,True,28,0.5,2,2,251,COMPLETE
61,0.7943398397499225,2025-06-15 14:20:46.296943,2025-06-15 14:21:44.450118,0 days 00:00:58.153175,True,28,0.5,2,2,234,COMPLETE
62,0.7896083785362034,2025-06-15 14:20:46.823110,2025-06-15 14:22:09.115052,0 days 00:01:22.291942,True,28,0.5,1,10,341,COMPLETE
63,0.8013670011471257,2025-06-15 14:20:56.177195,2025-06-15 14:22:44.567893,0 days 00:01:48.390698,True,28,0.5,1,3,438,COMPLETE
64,0.7994938147821495,2025-06-15 14:20:58.641751,2025-06-15 14:22:44.218499,0 days 00:01:45.576748,True,28,0.5,1,3,430,COMPLETE
65,0.7809834801008074,2025-06-15 14:21:04.317402,2025-06-15 14:22:44.920415,0 days 00:01:40.603013,True,28,0.5,4,3,438,COMPLETE
66,0.7783257369855698,2025-06-15 14:21:23.856328,2025-06-15 14:22:41.748023,0 days 00:01:17.891695,True,28,0.5,4,10,343,COMPLETE
67,0.7802955673711376,2025-06-15 14:21:44.455628,2025-06-15 14:23:25.278787,0 days 00:01:40.823159,True,25,0.5,4,3,438,COMPLETE
68,0.779950197067185,2025-06-15 14:21:47.897695,2025-06-15 14:23:07.300145,0 days 00:01:19.402450,True,25,0.5,4,3,348,COMPLETE
69,0.7941583897798944,2025-06-15 14:22:00.645734,2025-06-15 14:23:19.358660,0 days 00:01:18.712926,False,25,0.5,1,10,336,COMPLETE
70,0.7998260336648195,2025-06-15 14:22:09.118562,2025-06-15 14:23:56.898268,0 days 00:01:47.779706,False,25,0.5,1,3,431,COMPLETE
71,0.797044916741716,2025-06-15 14:22:41.757458,2025-06-15 14:24:31.705017,0 days 00:01:49.947559,False,25,0.5,1,3,428,COMPLETE
72,0.7999985574772838,2025-06-15 14:22:44.225940,2025-06-15 14:24:42.201197,0 days 00:01:57.975257,False,25,0.5,1,3,440,COMPLETE
73,0.7971623995880576,2025-06-15 14:22:44.571193,2025-06-15 14:24:41.597017,0 days 00:01:57.025824,False,25,0.5,1,3,439,COMPLETE
74,0.797417846490635,2025-06-15 14:22:44.923422,2025-06-15 14:24:37.391917,0 days 00:01:52.468495,False,25,0.5,1,3,427,COMPLETE
75,0.793121372755579,2025-06-15 14:23:07.304372,2025-06-15 14:24:29.353538,0 days 00:01:22.049166,False,29,0.5,1,9,322,COMPLETE
76,0.797064352675163,2025-06-15 14:23:19.364174,2025-06-15 14:24:39.233440,0 days 00:01:19.869266,False,29,0.5,1,9,314,COMPLETE
77,0.797687456466992,2025-06-15 14:23:25.284644,2025-06-15 14:24:46.585957,0 days 00:01:21.301313,False,29,0.5,1,7,318,COMPLETE
78,0.796165077701516,2025-06-15 14:23:56.900738,2025-06-15 14:25:16.965725,0 days 00:01:20.064987,False,29,0.5,1,3,309,COMPLETE
79,0.7981456771756907,2025-06-15 14:24:29.359473,2025-06-15 14:26:24.925837,0 days 00:01:55.566364,False,29,0.5,1,3,446,COMPLETE
80,0.7973986633930499,2025-06-15 14:24:31.712071,2025-06-15 14:26:20.647413,0 days 00:01:48.935342,False,23,0.5,1,7,430,COMPLETE
81,0.7989236135870197,2025-06-15 14:24:37.396922,2025-06-15 14:26:26.932377,0 days 00:01:49.535455,False,24,0.5,1,3,427,COMPLETE
82,0.7962381803409799,2025-06-15 14:24:39.238880,2025-06-15 14:26:27.535128,0 days 00:01:48.296248,False,23,0.5,1,7,425,COMPLETE
83,0.7961456050118728,2025-06-15 14:24:41.602544,2025-06-15 14:25:57.925427,0 days 00:01:16.322883,False,23,0.5,1,7,299,COMPLETE
84,0.7990109432210997,2025-06-15 14:24:42.207419,2025-06-15 14:26:35.772599,0 days 00:01:53.565180,False,23,0.5,1,3,448,COMPLETE
85,0.7963210112664295,2025-06-15 14:24:46.589956,2025-06-15 14:26:38.963076,0 days 00:01:52.373120,False,23,0.5,1,7,453,COMPLETE
86,0.7966422561472706,2025-06-15 14:25:16.970967,2025-06-15 14:27:17.814027,0 days 00:02:00.843060,False,23,0.5,1,7,484,COMPLETE
87,0.7949555691152226,2025-06-15 14:25:57.930431,2025-06-15 14:27:53.694344,0 days 00:01:55.763913,False,23,0.5,1,7,452,COMPLETE
88,0.7971678104575343,2025-06-15 14:26:20.655275,2025-06-15 14:28:16.651385,0 days 00:01:55.996110,False,18,0.5,1,7,448,COMPLETE
89,0.7975539928503356,2025-06-15 14:26:24.928113,2025-06-15 14:28:21.244804,0 days 00:01:56.316691,False,26,0.5,1,6,450,COMPLETE
90,0.7952252422127846,2025-06-15 14:26:26.937395,2025-06-15 14:28:23.829570,0 days 00:01:56.892175,False,26,0.5,1,8,451,COMPLETE
91,0.7973230612586035,2025-06-15 14:26:27.538875,2025-06-15 14:28:25.023504,0 days 00:01:57.484629,False,26,0.5,1,8,450,COMPLETE
92,0.7991676722357666,2025-06-15 14:26:35.777172,2025-06-15 14:28:36.669957,0 days 00:02:00.892785,False,18,0.5,1,3,449,COMPLETE
93,0.7976971662682261,2025-06-15 14:26:38.967871,2025-06-15 14:28:53.078125,0 days 00:02:14.110254,False,26,0.5,1,3,479,COMPLETE
94,0.7978377024065927,2025-06-15 14:27:17.817726,2025-06-15 14:29:25.396690,0 days 00:02:07.578964,False,26,0.5,1,3,449,COMPLETE
95,0.799815109566629,2025-06-15 14:27:53.700143,2025-06-15 14:30:12.746917,0 days 00:02:19.046774,False,26,0.5,1,3,486,COMPLETE
96,0.7992186187590389,2025-06-15 14:28:16.657390,2025-06-15 14:30:32.556986,0 days 00:02:15.899596,False,26,0.5,1,3,473,COMPLETE
97,0.7760517263388907,2025-06-15 14:28:21.246804,2025-06-15 14:30:15.878354,0 days 00:01:54.631550,False,24,log2,1,3,479,COMPLETE
98,0.7980349471452941,2025-06-15 14:28:23.835619,2025-06-15 14:30:39.934818,0 days 00:02:16.099199,False,30,0.5,1,3,475,COMPLETE
99,0.8001343019663617,2025-06-15 14:28:25.030406,2025-06-15 14:30:26.269320,0 days 00:02:01.238914,False,24,0.5,1,3,420,COMPLETE
100,0.7769085171189181,2025-06-15 14:28:36.677465,2025-06-15 14:30:36.422708,0 days 00:01:59.745243,False,9,0.5,1,3,476,COMPLETE
101,0.7665336550930177,2025-06-15 14:28:53.083126,2025-06-15 14:30:21.766283,0 days 00:01:28.683157,False,16,log2,1,3,420,COMPLETE
102,0.7598287817573179,2025-06-15 14:29:25.401867,2025-06-15 14:30:44.202530,0 days 00:01:18.800663,False,15,log2,1,4,404,COMPLETE
103,0.7599529590062485,2025-06-15 14:30:12.750916,2025-06-15 14:31:36.825025,0 days 00:01:24.074109,False,15,log2,1,4,489,COMPLETE
104,0.7974126923986531,2025-06-15 14:30:15.883869,2025-06-15 14:32:17.287410,0 days 00:02:01.403541,False,15,0.5,1,4,491,COMPLETE
105,0.745881645812912,2025-06-15 14:30:21.772352,2025-06-15 14:31:36.242302,0 days 00:01:14.469950,False,7,0.5,1,4,393,COMPLETE
106,0.7647191360113184,2025-06-15 14:30:26.277828,2025-06-15 14:31:45.706410,0 days 00:01:19.428582,False,8,0.5,1,4,399,COMPLETE
107,0.7978682095515884,2025-06-15 14:30:32.563770,2025-06-15 14:32:10.630436,0 days 00:01:38.066666,False,27,0.5,1,4,398,COMPLETE
108,0.7987902611497768,2025-06-15 14:30:36.425815,2025-06-15 14:32:38.791596,0 days 00:02:02.365781,False,24,0.5,1,4,486,COMPLETE
109,0.7978048467298768,2025-06-15 14:30:39.939327,2025-06-15 14:32:20.083760,0 days 00:01:40.144433,False,24,0.5,1,4,395,COMPLETE
110,0.7979538972804423,2025-06-15 14:30:44.206051,2025-06-15 14:32:51.126194,0 days 00:02:06.920143,False,24,0.5,1,4,492,COMPLETE
111,0.7995654421458556,2025-06-15 14:31:36.245792,2025-06-15 14:33:28.078630,0 days 00:01:51.832838,False,24,0.5,1,4,419,COMPLETE
112,0.8004577527995853,2025-06-15 14:31:36.831823,2025-06-15 14:33:30.471350,0 days 00:01:53.639527,False,24,0.5,1,3,419,COMPLETE
113,0.7984066831538603,2025-06-15 14:31:45.711918,2025-06-15 14:33:52.765991,0 days 00:02:07.054073,False,24,0.5,1,3,469,COMPLETE
114,0.798239079250531,2025-06-15 14:32:10.637438,2025-06-15 14:34:04.270225,0 days 00:01:53.632787,False,24,0.5,1,3,416,COMPLETE
115,0.7986925426754483,2025-06-15 14:32:17.295118,2025-06-15 14:34:26.944252,0 days 00:02:09.649134,False,24,0.5,1,3,472,COMPLETE
116,0.7987639435401841,2025-06-15 14:32:20.089131,2025-06-15 14:34:30.140888,0 days 00:02:10.051757,False,27,0.5,1,3,470,COMPLETE
117,0.8005746569780161,2025-06-15 14:32:38.796596,2025-06-15 14:34:46.858385,0 days 00:02:08.061789,False,27,0.5,1,3,468,COMPLETE
118,0.7998754496286766,2025-06-15 14:32:51.132707,2025-06-15 14:34:58.985294,0 days 00:02:07.852587,False,24,0.5,1,3,468,COMPLETE
119,0.7993941102357974,2025-06-15 14:33:28.083144,2025-06-15 14:35:22.681232,0 days 00:01:54.598088,False,27,0.5,1,3,417,COMPLETE
120,0.7995105931062536,2025-06-15 14:33:30.474351,2025-06-15 14:35:25.445246,0 days 00:01:54.970895,False,27,0.5,1,3,418,COMPLETE
121,0.797175970573277,2025-06-15 14:33:52.770122,2025-06-15 14:35:50.222634,0 days 00:01:57.452512,False,27,0.5,1,3,418,COMPLETE
122,0.7989417840888873,2025-06-15 14:34:04.272227,2025-06-15 14:36:07.388870,0 days 00:02:03.116643,False,27,0.5,1,3,435,COMPLETE
123,0.7999888145440582,2025-06-15 14:34:26.948257,2025-06-15 14:36:32.525133,0 days 00:02:05.576876,False,27,0.5,1,3,460,COMPLETE
124,0.798059289409192,2025-06-15 14:34:30.144329,2025-06-15 14:36:36.438602,0 days 00:02:06.294273,False,27,0.5,1,3,459,COMPLETE
125,0.7979797466453847,2025-06-15 14:34:46.862384,2025-06-15 14:36:50.814951,0 days 00:02:03.952567,False,27,0.5,1,3,459,COMPLETE
126,0.7989000980254699,2025-06-15 14:34:58.991345,2025-06-15 14:36:56.436058,0 days 00:01:57.444713,False,27,0.5,1,5,436,COMPLETE
127,0.7980026104355755,2025-06-15 14:35:22.685352,2025-06-15 14:36:59.721515,0 days 00:01:37.036163,False,27,0.5,1,5,376,COMPLETE
128,0.7985277567802521,2025-06-15 14:35:25.450491,2025-06-15 14:37:05.055437,0 days 00:01:39.604946,False,27,0.5,1,3,373,COMPLETE
129,0.7993788311204354,2025-06-15 14:35:50.226145,2025-06-15 14:37:32.731800,0 days 00:01:42.505655,False,27,0.5,1,3,380,COMPLETE
130,0.7966559567748244,2025-06-15 14:36:07.392876,2025-06-15 14:38:07.616151,0 days 00:02:00.223275,False,25,0.5,1,5,458,COMPLETE
131,0.7983297527935861,2025-06-15 14:36:32.530230,2025-06-15 14:38:34.924722,0 days 00:02:02.394492,False,25,0.5,1,5,459,COMPLETE
132,0.7966599069689035,2025-06-15 14:36:36.442602,2025-06-15 14:38:34.598298,0 days 00:01:58.155696,False,25,0.5,1,5,440,COMPLETE
133,0.7798457829612755,2025-06-15 14:36:50.821591,2025-06-15 14:38:33.651392,0 days 00:01:42.829801,False,25,sqrt,1,2,433,COMPLETE
134,0.7789251473356822,2025-06-15 14:36:56.440085,2025-06-15 14:38:25.081901,0 days 00:01:28.641816,False,25,sqrt,1,2,369,COMPLETE
135,0.7771986917997965,2025-06-15 14:36:59.726025,2025-06-15 14:38:51.347732,0 days 00:01:51.621707,True,25,sqrt,1,2,409,COMPLETE
136,0.6372972499244934,2025-06-15 14:37:05.060066,2025-06-15 14:38:39.769515,0 days 00:01:34.709449,True,25,sqrt,5,2,410,COMPLETE
137,0.6387929726578014,2025-06-15 14:37:32.739503,2025-06-15 14:39:06.071343,0 days 00:01:33.331840,True,25,sqrt,5,2,408,COMPLETE
138,0.6795547469205825,2025-06-15 14:38:07.625881,2025-06-15 14:39:20.581065,0 days 00:01:12.955184,False,28,sqrt,5,2,423,COMPLETE
139,0.7854502581717024,2025-06-15 14:38:25.088979,2025-06-15 14:40:04.646180,0 days 00:01:39.557201,False,28,0.5,5,3,406,COMPLETE
140,0.7722493618165164,2025-06-15 14:38:33.655902,2025-06-15 14:40:25.909553,0 days 00:01:52.253651,True,28,0.5,5,3,422,COMPLETE
141,0.7748970870946056,2025-06-15 14:38:34.605299,2025-06-15 14:40:27.534346,0 days 00:01:52.929047,True,28,0.5,5,3,422,COMPLETE
142,0.7990052447093146,2025-06-15 14:38:34.929323,2025-06-15 14:40:32.781164,0 days 00:01:57.851841,True,28,0.5,1,3,410,COMPLETE
143,0.8007482712116563,2025-06-15 14:38:39.774513,2025-06-15 14:40:42.557238,0 days 00:02:02.782725,True,28,0.5,1,3,424,COMPLETE
144,0.7981349695830235,2025-06-15 14:38:51.357393,2025-06-15 14:40:50.441279,0 days 00:01:59.083886,False,28,0.5,1,3,422,COMPLETE
145,0.7975705504032603,2025-06-15 14:39:06.077932,2025-06-15 14:41:06.900148,0 days 00:02:00.822216,False,28,0.5,1,3,422,COMPLETE
146,0.798593734391831,2025-06-15 14:39:20.589785,2025-06-15 14:41:20.640984,0 days 00:02:00.051199,False,28,0.5,1,3,421,COMPLETE
147,0.7991117078156564,2025-06-15 14:40:04.653795,2025-06-15 14:40:58.773545,0 days 00:00:54.119750,False,26,0.5,1,3,185,COMPLETE
148,0.7981166364555561,2025-06-15 14:40:25.916267,2025-06-15 14:42:32.206633,0 days 00:02:06.290366,False,26,0.5,1,3,440,COMPLETE
149,0.7988572843415577,2025-06-15 14:40:27.541854,2025-06-15 14:42:34.337315,0 days 00:02:06.795461,False,26,0.5,1,3,442,COMPLETE
150,0.7963070819124851,2025-06-15 14:40:32.788213,2025-06-15 14:42:39.326115,0 days 00:02:06.537902,False,26,0.5,1,3,441,COMPLETE
151,0.8017490759661454,2025-06-15 14:40:42.561237,2025-06-15 14:42:52.129379,0 days 00:02:09.568142,True,26,0.5,1,3,443,COMPLETE
152,0.8019358380681105,2025-06-15 14:40:50.448792,2025-06-15 14:41:38.473071,0 days 00:00:48.024279,True,26,0.5,1,3,159,COMPLETE
153,0.8017310075570727,2025-06-15 14:40:58.782713,2025-06-15 14:43:04.225716,0 days 00:02:05.443003,True,29,0.5,1,3,439,COMPLETE
154,0.7990595034347342,2025-06-15 14:41:06.904453,2025-06-15 14:42:18.036880,0 days 00:01:11.132427,True,29,0.5,1,3,237,COMPLETE
155,0.7993186027895811,2025-06-15 14:41:20.645658,2025-06-15 14:42:29.154502,0 days 00:01:08.508844,True,26,0.5,1,3,238,COMPLETE
156,0.8003099412284055,2025-06-15 14:41:38.477375,2025-06-15 14:42:18.274255,0 days 00:00:39.796880,True,26,0.5,1,3,135,COMPLETE
157,0.7985232759454762,2025-06-15 14:42:18.046467,2025-06-15 14:43:19.257635,0 days 00:01:01.211168,True,26,0.5,1,4,204,COMPLETE
158,0.796138515790576,2025-06-15 14:42:18.278709,2025-06-15 14:42:59.217253,0 days 00:00:40.938544,True,26,0.5,1,3,150,COMPLETE
159,0.797999908476449,2025-06-15 14:42:29.160563,2025-06-15 14:43:14.372150,0 days 00:00:45.211587,True,26,0.5,1,3,147,COMPLETE
160,0.799885219939448,2025-06-15 14:42:32.210897,2025-06-15 14:43:22.981095,0 days 00:00:50.770198,True,26,0.5,1,3,165,COMPLETE
161,0.7975759342119924,2025-06-15 14:42:34.345377,2025-06-15 14:43:14.570690,0 days 00:00:40.225313,True,29,0.5,1,3,133,COMPLETE
162,0.7955351458241691,2025-06-15 14:42:39.336374,2025-06-15 14:43:23.909521,0 days 00:00:44.573147,True,29,0.5,1,4,149,COMPLETE
163,0.7989690529213552,2025-06-15 14:42:52.134383,2025-06-15 14:43:26.060840,0 days 00:00:33.926457,True,26,0.5,1,4,105,COMPLETE
164,0.7994690440235597,2025-06-15 14:42:59.220773,2025-06-15 14:43:40.451877,0 days 00:00:41.231104,True,29,0.5,1,4,129,COMPLETE
165,0.7965946487473697,2025-06-15 14:43:04.232083,2025-06-15 14:43:44.671307,0 days 00:00:40.439224,True,29,0.5,1,4,132,COMPLETE
166,0.7975030049418022,2025-06-15 14:43:14.388852,2025-06-15 14:43:45.595623,0 days 00:00:31.206771,True,24,0.5,1,4,111,COMPLETE
