number,value,datetime_start,datetime_complete,duration,params_bootstrap,params_max_depth,params_max_features,params_min_samples_leaf,params_min_samples_split,params_n_estimators,state
167,0.7946711275984107,2025-06-15 14:43:14.580267,2025-06-15 14:43:45.203845,0 days 00:00:30.623578,True,30,0.5,1,4,109,COMPLETE
168,0.7993473010357661,2025-06-15 14:43:19.271344,2025-06-15 14:43:48.013285,0 days 00:00:28.741941,True,24,0.5,1,3,106,COMPLETE
169,0.7970066867152984,2025-06-15 14:43:22.985601,2025-06-15 14:44:06.918333,0 days 00:00:43.932732,True,24,0.5,1,4,164,COMPLETE
170,0.7961449772825837,2025-06-15 14:43:23.920121,2025-06-15 14:43:57.941363,0 days 00:00:34.021242,True,24,0.5,1,3,131,COMPLETE
171,0.7998582161248154,2025-06-15 14:43:26.068542,2025-06-15 14:44:03.560344,0 days 00:00:37.491802,True,30,0.5,1,3,141,COMPLETE
172,0.8016625870793922,2025-06-15 14:43:40.461067,2025-06-15 14:45:45.981977,0 days 00:02:05.520910,True,30,0.5,1,3,466,COMPLETE
173,0.7995116106381186,2025-06-15 14:43:44.679724,2025-06-15 14:44:29.417110,0 days 00:00:44.737386,True,24,0.5,1,3,161,COMPLETE
174,0.8008539159759094,2025-06-15 14:43:45.211361,2025-06-15 14:44:32.182111,0 days 00:00:46.970750,True,23,0.5,1,3,168,COMPLETE
175,0.7974768097078885,2025-06-15 14:43:45.600874,2025-06-15 14:44:34.426803,0 days 00:00:48.825929,True,24,0.5,1,3,175,COMPLETE
176,0.8014831258721301,2025-06-15 14:43:48.022865,2025-06-15 14:44:33.825941,0 days 00:00:45.803076,True,23,0.5,1,3,162,COMPLETE
177,0.8000525134786283,2025-06-15 14:43:57.951580,2025-06-15 14:44:41.467706,0 days 00:00:43.516126,True,23,0.5,1,3,157,COMPLETE
178,0.8002116110787784,2025-06-15 14:44:03.566850,2025-06-15 14:44:49.904018,0 days 00:00:46.337168,True,30,0.5,1,3,168,COMPLETE
179,0.8038735980906653,2025-06-15 14:44:06.922827,2025-06-15 14:46:14.747629,0 days 00:02:07.824802,True,30,0.5,1,3,467,COMPLETE
180,0.8000025871726344,2025-06-15 14:44:29.422167,2025-06-15 14:45:07.930900,0 days 00:00:38.508733,True,27,0.5,1,3,142,COMPLETE
181,0.7936174262843922,2025-06-15 14:44:32.188333,2025-06-15 14:45:17.798533,0 days 00:00:45.610200,True,12,0.5,1,3,172,COMPLETE
182,0.7991509072684304,2025-06-15 14:44:33.835595,2025-06-15 14:45:12.903295,0 days 00:00:39.067700,True,30,0.5,1,3,141,COMPLETE
183,0.800264038209017,2025-06-15 14:44:34.430805,2025-06-15 14:45:18.799025,0 days 00:00:44.368220,True,30,0.5,1,3,162,COMPLETE
184,0.7989079589095505,2025-06-15 14:44:41.470857,2025-06-15 14:45:15.067472,0 days 00:00:33.596615,True,30,0.5,1,3,119,COMPLETE
185,0.8031845910218005,2025-06-15 14:44:49.913026,2025-06-15 14:45:24.454168,0 days 00:00:34.541142,True,30,0.5,1,3,122,COMPLETE
186,0.7989904094785658,2025-06-15 14:45:07.936493,2025-06-15 14:45:40.256349,0 days 00:00:32.319856,True,22,0.5,1,3,120,COMPLETE
187,0.7990902728364415,2025-06-15 14:45:12.914143,2025-06-15 14:45:57.373207,0 days 00:00:44.459064,True,22,0.5,1,3,158,COMPLETE
188,0.7997195301072677,2025-06-15 14:45:15.076836,2025-06-15 14:45:58.846887,0 days 00:00:43.770051,True,22,0.5,1,3,158,COMPLETE
189,0.8005479227441862,2025-06-15 14:45:17.805516,2025-06-15 14:46:00.961452,0 days 00:00:43.155936,True,22,0.5,1,3,157,COMPLETE
190,0.7994826193999115,2025-06-15 14:45:18.804568,2025-06-15 14:46:02.268398,0 days 00:00:43.463830,True,22,0.5,1,3,157,COMPLETE
191,0.798023506226224,2025-06-15 14:45:24.486233,2025-06-15 14:46:07.826065,0 days 00:00:43.339832,True,22,0.5,1,3,157,COMPLETE
192,0.7712349403160879,2025-06-15 14:45:40.268843,2025-06-15 14:46:19.573393,0 days 00:00:39.304550,True,21,log2,1,3,158,COMPLETE
193,0.7970507114011471,2025-06-15 14:45:45.993725,2025-06-15 14:46:27.387680,0 days 00:00:41.393955,True,30,0.5,1,3,156,COMPLETE
194,0.7697869203265086,2025-06-15 14:45:57.380204,2025-06-15 14:46:37.218900,0 days 00:00:39.838696,True,30,log2,1,3,178,COMPLETE
195,0.7984508762372862,2025-06-15 14:45:58.851252,2025-06-15 14:46:42.031314,0 days 00:00:43.180062,True,30,0.5,1,3,187,COMPLETE
196,0.7679850147988975,2025-06-15 14:46:00.969982,2025-06-15 14:46:40.038470,0 days 00:00:39.068488,True,30,log2,1,3,182,COMPLETE
197,0.7735770844978653,2025-06-15 14:46:02.275910,2025-06-15 14:46:40.560309,0 days 00:00:38.284399,True,30,log2,1,3,183,COMPLETE
198,0.8010078387937861,2025-06-15 14:46:07.831253,2025-06-15 14:46:44.774974,0 days 00:00:36.943721,True,30,0.5,1,3,185,COMPLETE
199,0.7993830423574327,2025-06-15 14:46:14.751149,2025-06-15 14:46:46.217135,0 days 00:00:31.465986,True,30,0.5,1,3,181,COMPLETE
