number,value,datetime_start,datetime_complete,duration,params_bootstrap,params_max_depth,params_max_features,params_min_samples_leaf,params_min_samples_split,params_n_estimators,state
167,0.9205797064203951,2025-06-15 12:55:42.583290,2025-06-15 12:57:12.944375,0 days 00:01:30.361085,False,14,0.5,1,4,330,COMPLETE
168,0.9199715599264767,2025-06-15 12:56:03.887394,2025-06-15 12:57:35.258830,0 days 00:01:31.371436,False,14,0.5,1,4,331,COMPLETE
169,0.9189350813929206,2025-06-15 12:56:08.365313,2025-06-15 12:57:39.817690,0 days 00:01:31.452377,False,14,0.5,1,4,327,COMPLETE
170,0.9196690387667023,2025-06-15 12:56:08.747837,2025-06-15 12:57:32.967424,0 days 00:01:24.219587,False,12,0.5,1,4,315,COMPLETE
171,0.9198339765216236,2025-06-15 12:56:23.053155,2025-06-15 12:57:54.039083,0 days 00:01:30.985928,False,12,0.5,1,4,359,COMPLETE
172,0.9204016904624934,2025-06-15 12:56:27.265965,2025-06-15 12:57:55.447623,0 days 00:01:28.181658,False,12,0.5,1,4,330,COMPLETE
173,0.920083524959763,2025-06-15 12:56:51.281741,2025-06-15 12:58:18.681409,0 days 00:01:27.399668,False,12,0.5,1,4,331,COMPLETE
174,0.9195471808786744,2025-06-15 12:57:02.224201,2025-06-15 12:58:30.249131,0 days 00:01:28.024930,False,12,0.5,1,4,332,COMPLETE
175,0.9195362837459493,2025-06-15 12:57:12.949750,2025-06-15 12:58:41.548909,0 days 00:01:28.599159,False,12,0.5,1,4,340,COMPLETE
176,0.9200064362179114,2025-06-15 12:57:32.978641,2025-06-15 12:59:00.622334,0 days 00:01:27.643693,False,12,0.5,1,4,336,COMPLETE
177,0.9197007140746545,2025-06-15 12:57:35.264599,2025-06-15 12:59:25.022265,0 days 00:01:49.757666,False,12,0.5,1,4,425,COMPLETE
178,0.9200453554230276,2025-06-15 12:57:39.824073,2025-06-15 12:59:08.503069,0 days 00:01:28.678996,False,12,0.5,1,4,336,COMPLETE
179,0.9204981720020415,2025-06-15 12:57:54.047218,2025-06-15 12:59:09.739081,0 days 00:01:15.691863,False,12,0.5,1,4,287,COMPLETE
180,0.9205865351090518,2025-06-15 12:57:55.453703,2025-06-15 12:59:12.127693,0 days 00:01:16.673990,False,12,0.5,1,4,290,COMPLETE
181,0.9203744303145165,2025-06-15 12:58:18.692021,2025-06-15 12:59:30.987721,0 days 00:01:12.295700,False,12,0.5,1,4,285,COMPLETE
182,0.9180274179084185,2025-06-15 12:58:30.254280,2025-06-15 12:59:41.904616,0 days 00:01:11.650336,False,14,0.5,1,10,289,COMPLETE
183,0.9187214259750055,2025-06-15 12:58:41.554911,2025-06-15 13:00:01.803403,0 days 00:01:20.248492,False,14,0.5,1,4,312,COMPLETE
184,0.9194705119485496,2025-06-15 12:59:00.628347,2025-06-15 13:00:10.356288,0 days 00:01:09.727941,False,14,0.5,1,4,285,COMPLETE
185,0.9200068834792878,2025-06-15 12:59:08.510621,2025-06-15 13:00:16.510018,0 days 00:01:07.999397,False,14,0.5,1,5,289,COMPLETE
186,0.9194611601497058,2025-06-15 12:59:09.753356,2025-06-15 13:00:39.785002,0 days 00:01:30.031646,False,14,0.5,1,5,391,COMPLETE
187,0.9192438544197177,2025-06-15 12:59:12.131859,2025-06-15 13:00:43.746141,0 days 00:01:31.614282,False,14,0.5,1,5,393,COMPLETE
188,0.9198766739713389,2025-06-15 12:59:25.028647,2025-06-15 13:00:40.878181,0 days 00:01:15.849534,False,13,0.5,1,4,318,COMPLETE
189,0.9202212370695546,2025-06-15 12:59:30.996368,2025-06-15 13:00:43.134569,0 days 00:01:12.138201,False,13,0.5,1,4,311,COMPLETE
190,0.9206307944790204,2025-06-15 12:59:41.913642,2025-06-15 13:00:57.212512,0 days 00:01:15.298870,False,13,0.5,1,4,321,COMPLETE
191,0.9210259277632904,2025-06-15 13:00:01.807813,2025-06-15 13:01:02.476361,0 days 00:01:00.668548,False,13,0.5,1,4,262,COMPLETE
192,0.9188597078270122,2025-06-15 13:00:10.362375,2025-06-15 13:01:26.786820,0 days 00:01:16.424445,False,13,0.5,1,5,320,COMPLETE
193,0.9163065950483864,2025-06-15 13:00:16.515112,2025-06-15 13:01:44.961855,0 days 00:01:28.446743,False,13,0.5,4,4,394,COMPLETE
194,0.9210989379807419,2025-06-15 13:00:39.788810,2025-06-15 13:01:50.142511,0 days 00:01:10.353701,False,13,0.5,1,4,322,COMPLETE
195,0.9209692272199798,2025-06-15 13:00:40.883644,2025-06-15 13:02:05.146038,0 days 00:01:24.262394,False,13,0.5,1,4,445,COMPLETE
196,0.9208989386603053,2025-06-15 13:00:43.141005,2025-06-15 13:01:41.757401,0 days 00:00:58.616396,False,13,0.5,1,4,253,COMPLETE
197,0.9202860765642835,2025-06-15 13:00:43.751143,2025-06-15 13:01:45.106546,0 days 00:01:01.355403,False,13,0.5,1,4,267,COMPLETE
198,0.9205433840134895,2025-06-15 13:00:57.216513,2025-06-15 13:02:02.819223,0 days 00:01:05.602710,False,13,0.5,1,4,351,COMPLETE
199,0.9206626785575956,2025-06-15 13:01:02.480523,2025-06-15 13:01:52.369227,0 days 00:00:49.888704,False,13,0.5,1,4,240,COMPLETE
