number,value,datetime_start,datetime_complete,duration,params_bootstrap,params_max_depth,params_max_features,params_min_samples_leaf,params_min_samples_split,params_n_estimators,state
0,0.9148498716654876,2025-06-15 12:27:42.465949,2025-06-15 12:28:21.370387,0 days 00:00:38.904438,False,19,0.5,4,4,138,COMPLETE
1,0.91523202242596,2025-06-15 12:27:42.472789,2025-06-15 12:28:50.348708,0 days 00:01:07.875919,False,16,0.5,5,8,252,COMPLETE
2,0.9075602050116658,2025-06-15 12:27:42.475454,2025-06-15 12:28:45.861600,0 days 00:01:03.386146,False,13,sqrt,4,7,325,COMPLETE
3,0.9009611044643929,2025-06-15 12:27:42.478093,2025-06-15 12:29:00.242487,0 days 00:01:17.764394,False,8,sqrt,3,2,429,COMPLETE
4,0.9142995139463936,2025-06-15 12:27:42.481282,2025-06-15 12:29:17.512742,0 days 00:01:35.031460,False,21,0.5,4,10,354,COMPLETE
5,0.908438792326877,2025-06-15 12:27:42.482870,2025-06-15 12:29:14.879203,0 days 00:01:32.396333,False,23,sqrt,4,10,482,COMPLETE
6,0.9021809357851278,2025-06-15 12:27:42.484464,2025-06-15 12:29:41.889174,0 days 00:01:59.404710,True,28,sqrt,5,6,493,COMPLETE
7,0.9128763840642348,2025-06-15 12:27:42.484985,2025-06-15 12:28:59.048337,0 days 00:01:16.563352,False,19,log2,2,2,393,COMPLETE
8,0.8975484822926504,2025-06-15 12:28:21.378356,2025-06-15 12:29:19.116176,0 days 00:00:57.737820,False,9,log2,4,10,332,COMPLETE
9,0.9162791506436685,2025-06-15 12:28:45.873150,2025-06-15 12:30:31.021037,0 days 00:01:45.147887,True,18,0.5,2,9,383,COMPLETE
10,0.8935363171658672,2025-06-15 12:28:50.373746,2025-06-15 12:29:46.036094,0 days 00:00:55.662348,True,8,log2,5,10,248,COMPLETE
11,0.9009971664205677,2025-06-15 12:28:59.055245,2025-06-15 12:29:35.346404,0 days 00:00:36.291159,True,22,log2,4,6,156,COMPLETE
12,0.9007157470747501,2025-06-15 12:29:00.254878,2025-06-15 12:30:30.903323,0 days 00:01:30.648445,True,23,log2,4,5,412,COMPLETE
13,0.8913632005983032,2025-06-15 12:29:14.886525,2025-06-15 12:30:18.923744,0 days 00:01:04.037219,False,5,sqrt,2,3,416,COMPLETE
14,0.9072471775985861,2025-06-15 12:29:17.520190,2025-06-15 12:30:05.499995,0 days 00:00:47.979805,False,28,log2,1,9,259,COMPLETE
15,0.9069322262424079,2025-06-15 12:29:19.120910,2025-06-15 12:30:36.092967,0 days 00:01:16.972057,True,26,sqrt,3,8,347,COMPLETE
16,0.9008206097849832,2025-06-15 12:29:35.356990,2025-06-15 12:30:19.396825,0 days 00:00:44.039835,True,9,log2,2,5,196,COMPLETE
17,0.916099986635586,2025-06-15 12:29:41.897405,2025-06-15 12:30:46.582982,0 days 00:01:04.685577,True,14,0.5,1,8,243,COMPLETE
18,0.9191968301492489,2025-06-15 12:29:46.049289,2025-06-15 12:30:21.268202,0 days 00:00:35.218913,False,14,0.5,1,4,139,COMPLETE
19,0.9153942397659252,2025-06-15 12:30:05.506141,2025-06-15 12:30:31.900315,0 days 00:00:26.394174,False,15,0.5,5,4,110,COMPLETE
20,0.9137562168546438,2025-06-15 12:30:18.929403,2025-06-15 12:30:45.096537,0 days 00:00:26.167134,False,15,0.5,5,4,115,COMPLETE
21,0.9144292387014842,2025-06-15 12:30:19.402219,2025-06-15 12:30:47.336788,0 days 00:00:27.934569,False,17,0.5,5,4,122,COMPLETE
22,0.9191451157470075,2025-06-15 12:30:21.273575,2025-06-15 12:30:45.535009,0 days 00:00:24.261434,False,14,0.5,1,8,100,COMPLETE
23,0.9189626147352493,2025-06-15 12:30:30.908336,2025-06-15 12:30:55.466078,0 days 00:00:24.557742,False,14,0.5,1,8,101,COMPLETE
24,0.9167427610156477,2025-06-15 12:30:31.028456,2025-06-15 12:30:56.475893,0 days 00:00:25.447437,True,14,0.5,1,8,100,COMPLETE
25,0.9162359293961521,2025-06-15 12:30:31.909557,2025-06-15 12:31:24.597958,0 days 00:00:52.688401,True,13,0.5,1,8,207,COMPLETE
26,0.9171957880365097,2025-06-15 12:30:36.097969,2025-06-15 12:31:26.999711,0 days 00:00:50.901742,True,13,0.5,1,7,203,COMPLETE
27,0.9179766062116679,2025-06-15 12:30:45.105422,2025-06-15 12:31:52.975741,0 days 00:01:07.870319,True,12,0.5,1,7,289,COMPLETE
28,0.9168552816217851,2025-06-15 12:30:45.541309,2025-06-15 12:31:31.970236,0 days 00:00:46.428927,True,12,0.5,1,8,187,COMPLETE
29,0.9171952358013229,2025-06-15 12:30:46.594152,2025-06-15 12:31:31.924610,0 days 00:00:45.330458,True,12,0.5,1,9,185,COMPLETE
30,0.9165960599401295,2025-06-15 12:30:47.342789,2025-06-15 12:31:33.069580,0 days 00:00:45.726791,True,12,0.5,1,7,185,COMPLETE
31,0.919622860875007,2025-06-15 12:30:55.476536,2025-06-15 12:31:35.597225,0 days 00:00:40.120689,False,12,0.5,1,7,172,COMPLETE
32,0.9194673842090879,2025-06-15 12:30:56.483370,2025-06-15 12:31:35.139112,0 days 00:00:38.655742,False,12,0.5,1,7,165,COMPLETE
33,0.9187449654836055,2025-06-15 12:31:24.608768,2025-06-15 12:32:02.047215,0 days 00:00:37.438447,False,11,0.5,1,7,172,COMPLETE
34,0.9195496125710007,2025-06-15 12:31:27.006723,2025-06-15 12:32:00.985115,0 days 00:00:33.978392,False,12,0.5,1,7,156,COMPLETE
35,0.9173437537681192,2025-06-15 12:31:31.930626,2025-06-15 12:32:03.848789,0 days 00:00:31.918163,False,10,0.5,2,7,156,COMPLETE
36,0.9194472274709588,2025-06-15 12:31:31.983984,2025-06-15 12:32:04.456575,0 days 00:00:32.472591,False,11,0.5,2,7,150,COMPLETE
37,0.9192476090676769,2025-06-15 12:31:33.078173,2025-06-15 12:32:06.067561,0 days 00:00:32.989388,False,19,0.5,2,5,149,COMPLETE
38,0.9179303129776665,2025-06-15 12:31:35.144748,2025-06-15 12:32:04.047664,0 days 00:00:28.902916,False,10,0.5,2,7,142,COMPLETE
39,0.9176090124808001,2025-06-15 12:31:35.603222,2025-06-15 12:32:06.614104,0 days 00:00:31.010882,False,10,0.5,2,5,150,COMPLETE
40,0.917867068529253,2025-06-15 12:31:52.982235,2025-06-15 12:32:24.714928,0 days 00:00:31.732693,False,10,0.5,2,5,151,COMPLETE
41,0.9179158593344259,2025-06-15 12:32:00.988169,2025-06-15 12:32:32.554452,0 days 00:00:31.566283,False,10,0.5,2,6,145,COMPLETE
42,0.9168047085469764,2025-06-15 12:32:02.053547,2025-06-15 12:32:33.969829,0 days 00:00:31.916282,False,10,0.5,2,5,146,COMPLETE
43,0.8958301473888627,2025-06-15 12:32:03.855855,2025-06-15 12:32:29.479570,0 days 00:00:25.623715,False,5,0.5,2,5,142,COMPLETE
44,0.9045839685534721,2025-06-15 12:32:04.052664,2025-06-15 12:32:47.046741,0 days 00:00:42.994077,False,6,0.5,2,5,226,COMPLETE
45,0.9046545570880736,2025-06-15 12:32:04.463444,2025-06-15 12:32:47.310675,0 days 00:00:42.847231,False,6,0.5,3,6,224,COMPLETE
46,0.8966664671269389,2025-06-15 12:32:06.072772,2025-06-15 12:32:35.528877,0 days 00:00:29.456105,False,6,sqrt,3,6,211,COMPLETE
47,0.8908246012848847,2025-06-15 12:32:06.628987,2025-06-15 12:32:35.794817,0 days 00:00:29.165830,False,5,sqrt,3,6,214,COMPLETE
48,0.9162682945681666,2025-06-15 12:32:24.723126,2025-06-15 12:33:16.130100,0 days 00:00:51.406974,False,20,0.5,3,6,221,COMPLETE
49,0.9169300083826035,2025-06-15 12:32:29.482570,2025-06-15 12:33:21.304624,0 days 00:00:51.822054,False,20,0.5,3,6,222,COMPLETE
50,0.9002090254079901,2025-06-15 12:32:32.560490,2025-06-15 12:33:03.371611,0 days 00:00:30.811121,False,7,sqrt,2,6,230,COMPLETE
51,0.911556510202059,2025-06-15 12:32:33.979287,2025-06-15 12:33:06.480379,0 days 00:00:32.501092,False,20,sqrt,3,6,213,COMPLETE
52,0.9177340303446613,2025-06-15 12:32:35.531988,2025-06-15 12:33:30.354899,0 days 00:00:54.822911,False,18,0.5,3,6,235,COMPLETE
53,0.9174329471908557,2025-06-15 12:32:35.802729,2025-06-15 12:33:17.083226,0 days 00:00:41.280497,False,20,0.5,3,6,172,COMPLETE
54,0.9178028781437012,2025-06-15 12:32:47.056666,2025-06-15 12:33:28.476065,0 days 00:00:41.419399,False,19,0.5,1,6,171,COMPLETE
55,0.9168751830187306,2025-06-15 12:32:47.315509,2025-06-15 12:33:51.995690,0 days 00:01:04.680181,False,20,0.5,3,7,276,COMPLETE
56,0.9164957772271659,2025-06-15 12:33:03.376450,2025-06-15 12:33:43.910857,0 days 00:00:40.534407,False,19,0.5,1,9,169,COMPLETE
57,0.9115465088802484,2025-06-15 12:33:06.487379,2025-06-15 12:33:32.131366,0 days 00:00:25.643987,False,17,log2,1,7,169,COMPLETE
58,0.9194214280428836,2025-06-15 12:33:16.134099,2025-06-15 12:33:46.891667,0 days 00:00:30.757568,False,17,0.5,1,3,127,COMPLETE
59,0.9189923755815743,2025-06-15 12:33:17.089227,2025-06-15 12:33:48.292970,0 days 00:00:31.203743,False,17,0.5,1,3,127,COMPLETE
60,0.9102375469300938,2025-06-15 12:33:21.307624,2025-06-15 12:33:42.015722,0 days 00:00:20.708098,False,17,log2,1,3,129,COMPLETE
61,0.9098193012455533,2025-06-15 12:33:28.483065,2025-06-15 12:33:49.178747,0 days 00:00:20.695682,False,17,log2,1,3,126,COMPLETE
62,0.9092246766328926,2025-06-15 12:33:30.360713,2025-06-15 12:33:51.085371,0 days 00:00:20.724658,False,17,log2,1,2,127,COMPLETE
63,0.9192070693682346,2025-06-15 12:33:32.137981,2025-06-15 12:34:01.999240,0 days 00:00:29.861259,False,16,0.5,1,2,127,COMPLETE
64,0.9184488667558425,2025-06-15 12:33:42.022081,2025-06-15 12:34:43.011897,0 days 00:01:00.989816,False,16,0.5,1,2,273,COMPLETE
65,0.9193222533343308,2025-06-15 12:33:43.919958,2025-06-15 12:34:45.725488,0 days 00:01:01.805530,False,16,0.5,1,3,273,COMPLETE
66,0.9168652169135119,2025-06-15 12:33:46.897780,2025-06-15 12:34:15.294026,0 days 00:00:28.396246,False,24,0.5,1,3,125,COMPLETE
67,0.9158379219365106,2025-06-15 12:33:48.299296,2025-06-15 12:34:49.925102,0 days 00:01:01.625806,False,24,0.5,1,2,266,COMPLETE
68,0.916616210774406,2025-06-15 12:33:49.186194,2025-06-15 12:34:16.186901,0 days 00:00:27.000707,False,23,0.5,1,2,115,COMPLETE
69,0.919866300519578,2025-06-15 12:33:51.100484,2025-06-15 12:34:52.059768,0 days 00:01:00.959284,False,15,0.5,1,4,276,COMPLETE
70,0.9202663511123299,2025-06-15 12:33:52.002734,2025-06-15 12:35:34.076460,0 days 00:01:42.073726,False,15,0.5,1,4,453,COMPLETE
71,0.9189704161078527,2025-06-15 12:34:02.007230,2025-06-15 12:34:28.438543,0 days 00:00:26.431313,False,15,0.5,1,2,113,COMPLETE
72,0.9202060903607917,2025-06-15 12:34:15.299028,2025-06-15 12:36:00.307461,0 days 00:01:45.008433,False,15,0.5,1,2,465,COMPLETE
73,0.9198905218006826,2025-06-15 12:34:16.191985,2025-06-15 12:35:29.699877,0 days 00:01:13.507892,False,15,0.5,1,2,320,COMPLETE
74,0.9202788265353797,2025-06-15 12:34:28.441539,2025-06-15 12:35:12.746508,0 days 00:00:44.304969,False,16,0.5,1,2,189,COMPLETE
75,0.9135103704391441,2025-06-15 12:34:43.015064,2025-06-15 12:35:13.135701,0 days 00:00:30.120637,False,8,0.5,2,8,160,COMPLETE
76,0.9136473465157952,2025-06-15 12:34:45.729732,2025-06-15 12:35:54.401187,0 days 00:01:08.671455,False,8,0.5,2,4,358,COMPLETE
77,0.9130535749055136,2025-06-15 12:34:49.930277,2025-06-15 12:35:47.198651,0 days 00:00:57.268374,False,8,0.5,2,4,303,COMPLETE
78,0.920678334661417,2025-06-15 12:34:52.063766,2025-06-15 12:35:58.817405,0 days 00:01:06.753639,False,13,0.5,1,4,296,COMPLETE
79,0.9206102663817625,2025-06-15 12:35:12.754669,2025-06-15 12:36:42.654019,0 days 00:01:29.899350,False,13,0.5,1,4,375,COMPLETE
80,0.9199076473129473,2025-06-15 12:35:13.140754,2025-06-15 12:36:27.046577,0 days 00:01:13.905823,False,13,0.5,1,4,321,COMPLETE
81,0.9198925898906554,2025-06-15 12:35:29.707381,2025-06-15 12:36:58.352333,0 days 00:01:28.644952,False,13,0.5,1,7,377,COMPLETE
82,0.9199830579811911,2025-06-15 12:35:34.082055,2025-06-15 12:37:28.893021,0 days 00:01:54.810966,False,13,0.5,1,4,476,COMPLETE
83,0.9193829432840002,2025-06-15 12:35:47.207663,2025-06-15 12:37:33.444401,0 days 00:01:46.236738,False,13,0.5,1,7,449,COMPLETE
84,0.9189291328345238,2025-06-15 12:35:54.408279,2025-06-15 12:37:38.557656,0 days 00:01:44.149377,False,13,0.5,1,7,438,COMPLETE
85,0.9208757659800885,2025-06-15 12:35:58.821540,2025-06-15 12:37:43.925441,0 days 00:01:45.103901,False,13,0.5,1,4,437,COMPLETE
86,0.9187940445091607,2025-06-15 12:36:00.312461,2025-06-15 12:37:51.881285,0 days 00:01:51.568824,False,13,0.5,1,2,460,COMPLETE
87,0.9198709105906335,2025-06-15 12:36:27.050586,2025-06-15 12:38:17.643692,0 days 00:01:50.593106,False,13,0.5,1,4,456,COMPLETE
88,0.920572214521054,2025-06-15 12:36:42.660361,2025-06-15 12:38:41.415648,0 days 00:01:58.755287,False,13,0.5,1,4,469,COMPLETE
89,0.9207205872809956,2025-06-15 12:36:58.357471,2025-06-15 12:38:58.080778,0 days 00:01:59.723307,False,15,0.5,1,4,467,COMPLETE
90,0.9208129067620654,2025-06-15 12:37:28.896049,2025-06-15 12:39:28.445695,0 days 00:01:59.549646,False,13,0.5,1,4,462,COMPLETE
91,0.9191316857568108,2025-06-15 12:37:33.450907,2025-06-15 12:39:36.570042,0 days 00:02:03.119135,False,14,0.5,1,4,469,COMPLETE
92,0.9201774280635039,2025-06-15 12:37:38.562432,2025-06-15 12:39:45.153654,0 days 00:02:06.591222,False,14,0.5,1,4,484,COMPLETE
93,0.9203313811868163,2025-06-15 12:37:43.930791,2025-06-15 12:39:42.696831,0 days 00:01:58.766040,False,11,0.5,1,4,474,COMPLETE
94,0.9176929853205481,2025-06-15 12:37:51.888590,2025-06-15 12:40:18.496910,0 days 00:02:26.608320,True,14,0.5,1,4,496,COMPLETE
95,0.9121948809493441,2025-06-15 12:38:17.649348,2025-06-15 12:40:26.791819,0 days 00:02:09.142471,True,14,sqrt,1,4,496,COMPLETE
96,0.9119832319668006,2025-06-15 12:38:41.422522,2025-06-15 12:40:58.672314,0 days 00:02:17.249792,True,14,sqrt,1,4,500,COMPLETE
97,0.9127564378132993,2025-06-15 12:38:58.085291,2025-06-15 12:41:12.093903,0 days 00:02:14.008612,True,14,sqrt,1,4,491,COMPLETE
98,0.9194699007314954,2025-06-15 12:39:28.450901,2025-06-15 12:41:41.688650,0 days 00:02:13.237749,False,14,0.5,1,4,492,COMPLETE
99,0.916069606884682,2025-06-15 12:39:36.575006,2025-06-15 12:42:00.870861,0 days 00:02:24.295855,True,11,0.5,1,4,499,COMPLETE
100,0.9090806043584457,2025-06-15 12:39:42.704384,2025-06-15 12:41:46.144987,0 days 00:02:03.440603,True,11,sqrt,1,4,500,COMPLETE
101,0.9127490926377287,2025-06-15 12:39:45.162685,2025-06-15 12:41:13.712102,0 days 00:01:28.549417,False,14,sqrt,1,3,415,COMPLETE
102,0.9117754668349759,2025-06-15 12:40:18.503568,2025-06-15 12:41:43.551642,0 days 00:01:25.048074,False,16,sqrt,1,3,419,COMPLETE
103,0.9184457771770493,2025-06-15 12:40:26.800542,2025-06-15 12:42:08.080751,0 days 00:01:41.280209,False,11,0.5,1,3,413,COMPLETE
104,0.9191343159566541,2025-06-15 12:40:58.731729,2025-06-15 12:42:39.398849,0 days 00:01:40.667120,False,11,0.5,1,3,414,COMPLETE
105,0.9188598955118321,2025-06-15 12:41:12.102367,2025-06-15 12:42:48.257796,0 days 00:01:36.155429,False,11,0.5,1,5,413,COMPLETE
106,0.9157409952113797,2025-06-15 12:41:13.720196,2025-06-15 12:42:45.068775,0 days 00:01:31.348579,False,11,0.5,4,5,401,COMPLETE
107,0.9160556096904751,2025-06-15 12:41:41.694078,2025-06-15 12:43:17.961918,0 days 00:01:36.267840,False,11,0.5,4,5,428,COMPLETE
108,0.9183547543728607,2025-06-15 12:41:43.557625,2025-06-15 12:43:15.153306,0 days 00:01:31.595681,False,11,0.5,1,5,400,COMPLETE
109,0.9192136136123519,2025-06-15 12:41:46.152449,2025-06-15 12:43:35.730104,0 days 00:01:49.577655,False,15,0.5,1,5,440,COMPLETE
110,0.9193012851707296,2025-06-15 12:42:00.879370,2025-06-15 12:43:51.804481,0 days 00:01:50.925111,False,15,0.5,1,5,436,COMPLETE
111,0.9192274830767365,2025-06-15 12:42:08.085752,2025-06-15 12:43:59.421719,0 days 00:01:51.335967,False,15,0.5,1,5,437,COMPLETE
112,0.9194675901766635,2025-06-15 12:42:39.408501,2025-06-15 12:44:38.428511,0 days 00:01:59.020010,False,15,0.5,1,5,436,COMPLETE
113,0.9189147434885552,2025-06-15 12:42:45.077616,2025-06-15 12:44:47.239680,0 days 00:02:02.162064,False,15,0.5,1,5,438,COMPLETE
114,0.9188784211421808,2025-06-15 12:42:48.262140,2025-06-15 12:44:47.840252,0 days 00:01:59.578112,False,15,0.5,1,5,437,COMPLETE
115,0.9191268166850015,2025-06-15 12:43:15.158747,2025-06-15 12:45:22.672539,0 days 00:02:07.513792,False,15,0.5,1,4,437,COMPLETE
116,0.9204575487370035,2025-06-15 12:43:17.968231,2025-06-15 12:45:42.013731,0 days 00:02:24.045500,False,15,0.5,1,4,480,COMPLETE
117,0.919975433584756,2025-06-15 12:43:35.736725,2025-06-15 12:46:03.058733,0 days 00:02:27.322008,False,12,0.5,1,4,479,COMPLETE
118,0.9206779098661043,2025-06-15 12:43:51.808480,2025-06-15 12:46:25.951279,0 days 00:02:34.142799,False,12,0.5,1,4,478,COMPLETE
119,0.9201286400883045,2025-06-15 12:43:59.426721,2025-06-15 12:46:36.049996,0 days 00:02:36.623275,False,12,0.5,1,4,478,COMPLETE
120,0.9202268771362387,2025-06-15 12:44:38.438177,2025-06-15 12:47:19.928664,0 days 00:02:41.490487,False,12,0.5,1,4,477,COMPLETE
121,0.9169399693341196,2025-06-15 12:44:47.247792,2025-06-15 12:47:36.003053,0 days 00:02:48.755261,False,30,0.5,1,4,476,COMPLETE
122,0.9056761787405891,2025-06-15 12:44:47.851131,2025-06-15 12:46:51.548952,0 days 00:02:03.697821,False,30,log2,1,4,472,COMPLETE
123,0.9126644021110485,2025-06-15 12:45:22.681539,2025-06-15 12:47:27.246460,0 days 00:02:04.564921,False,16,log2,1,4,475,COMPLETE
124,0.9107176028994022,2025-06-15 12:45:42.018756,2025-06-15 12:47:43.732115,0 days 00:02:01.713359,False,12,log2,1,4,482,COMPLETE
125,0.9047871716431504,2025-06-15 12:46:03.067603,2025-06-15 12:48:07.557151,0 days 00:02:04.489548,False,30,log2,1,4,468,COMPLETE
126,0.9108254672309014,2025-06-15 12:46:25.964767,2025-06-15 12:48:21.629425,0 days 00:01:55.664658,False,16,log2,1,3,468,COMPLETE
127,0.9101032011492343,2025-06-15 12:46:36.056273,2025-06-15 12:48:26.836170,0 days 00:01:50.779897,False,16,log2,1,3,464,COMPLETE
128,0.919022946660583,2025-06-15 12:46:51.563234,2025-06-15 12:49:16.821458,0 days 00:02:25.258224,False,16,0.5,1,4,461,COMPLETE
129,0.9172940266704964,2025-06-15 12:47:19.935784,2025-06-15 12:49:24.775502,0 days 00:02:04.839718,False,9,0.5,1,3,462,COMPLETE
130,0.9157860578630679,2025-06-15 12:47:27.253484,2025-06-15 12:49:29.815415,0 days 00:02:02.561931,False,9,0.5,1,3,463,COMPLETE
131,0.9172508391846488,2025-06-15 12:47:36.009580,2025-06-15 12:49:35.994519,0 days 00:01:59.984939,False,9,0.5,1,3,463,COMPLETE
132,0.9167866494739689,2025-06-15 12:47:43.737649,2025-06-15 12:49:42.227484,0 days 00:01:58.489835,False,9,0.5,1,3,464,COMPLETE
133,0.9162385648705303,2025-06-15 12:48:07.561761,2025-06-15 12:50:01.357418,0 days 00:01:53.795657,False,9,0.5,1,3,454,COMPLETE
134,0.9212606415140273,2025-06-15 12:48:21.634678,2025-06-15 12:50:30.732859,0 days 00:02:09.098181,False,13,0.5,1,3,458,COMPLETE
135,0.9176714936474841,2025-06-15 12:48:26.841274,2025-06-15 12:50:17.793735,0 days 00:01:50.952461,False,9,0.5,1,3,450,COMPLETE
136,0.9167283150623524,2025-06-15 12:49:16.828993,2025-06-15 12:51:07.846925,0 days 00:01:51.017932,False,9,0.5,1,3,453,COMPLETE
137,0.9180445078322077,2025-06-15 12:49:24.785023,2025-06-15 12:51:12.861515,0 days 00:01:48.076492,False,18,0.5,1,4,373,COMPLETE
138,0.9207125461081823,2025-06-15 12:49:29.819951,2025-06-15 12:51:32.623958,0 days 00:02:02.804007,False,12,0.5,1,4,452,COMPLETE
139,0.9193673839254458,2025-06-15 12:49:36.001661,2025-06-15 12:51:56.574481,0 days 00:02:20.572820,False,12,0.5,1,4,488,COMPLETE
140,0.9198658257273834,2025-06-15 12:49:42.236826,2025-06-15 12:51:46.083883,0 days 00:02:03.847057,False,12,0.5,1,4,451,COMPLETE
141,0.9206387827527553,2025-06-15 12:50:01.367545,2025-06-15 12:52:23.586277,0 days 00:02:22.218732,False,13,0.5,1,4,485,COMPLETE
142,0.9206218089556139,2025-06-15 12:50:17.802988,2025-06-15 12:52:39.943071,0 days 00:02:22.140083,False,13,0.5,1,4,484,COMPLETE
143,0.9207024803537015,2025-06-15 12:50:30.736357,2025-06-15 12:52:22.953798,0 days 00:01:52.217441,False,13,0.5,1,2,378,COMPLETE
144,0.9142516907748443,2025-06-15 12:51:07.852368,2025-06-15 12:53:20.993536,0 days 00:02:13.141168,False,18,0.5,5,2,487,COMPLETE
145,0.9154227951174597,2025-06-15 12:51:12.867572,2025-06-15 12:53:26.092572,0 days 00:02:13.225000,False,13,0.5,5,2,486,COMPLETE
146,0.9193502114519537,2025-06-15 12:51:32.632165,2025-06-15 12:53:38.369754,0 days 00:02:05.737589,False,12,0.5,1,4,445,COMPLETE
147,0.9210425674749427,2025-06-15 12:51:46.089153,2025-06-15 12:53:24.403313,0 days 00:01:38.314160,False,13,0.5,1,4,335,COMPLETE
148,0.9193058010078717,2025-06-15 12:51:56.579934,2025-06-15 12:53:33.378018,0 days 00:01:36.798084,False,13,0.5,1,2,345,COMPLETE
149,0.9206806616195964,2025-06-15 12:52:22.958218,2025-06-15 12:54:25.196841,0 days 00:02:02.238623,False,13,0.5,1,4,444,COMPLETE
150,0.9200959544373702,2025-06-15 12:52:23.591881,2025-06-15 12:53:57.136909,0 days 00:01:33.545028,False,13,0.5,1,2,340,COMPLETE
151,0.9205553879554763,2025-06-15 12:52:39.946896,2025-06-15 12:54:01.601362,0 days 00:01:21.654466,False,13,0.5,1,2,295,COMPLETE
152,0.9215713229549468,2025-06-15 12:53:21.000896,2025-06-15 12:54:52.613657,0 days 00:01:31.612761,False,13,0.5,1,4,340,COMPLETE
153,0.9205619584087529,2025-06-15 12:53:24.410444,2025-06-15 12:54:45.868126,0 days 00:01:21.457682,False,13,0.5,1,4,300,COMPLETE
154,0.9205996763562163,2025-06-15 12:53:26.128322,2025-06-15 12:54:46.451170,0 days 00:01:20.322848,False,13,0.5,1,4,300,COMPLETE
155,0.920442027756545,2025-06-15 12:53:33.383484,2025-06-15 12:54:53.498021,0 days 00:01:20.114537,False,13,0.5,1,4,301,COMPLETE
156,0.9194971424167937,2025-06-15 12:53:38.371753,2025-06-15 12:54:57.397412,0 days 00:01:19.025659,False,13,0.5,1,4,307,COMPLETE
157,0.920260314935055,2025-06-15 12:53:57.141411,2025-06-15 12:55:14.163740,0 days 00:01:17.022329,False,13,0.5,1,4,298,COMPLETE
158,0.9200204893081743,2025-06-15 12:54:01.605091,2025-06-15 12:55:38.329557,0 days 00:01:36.724466,False,13,0.5,1,4,372,COMPLETE
159,0.9205837478616455,2025-06-15 12:54:25.201905,2025-06-15 12:55:42.578262,0 days 00:01:17.376357,False,13,0.5,1,4,305,COMPLETE
160,0.9209679749146888,2025-06-15 12:54:45.871434,2025-06-15 12:56:03.880813,0 days 00:01:18.009379,False,13,0.5,1,4,301,COMPLETE
161,0.9207368830667356,2025-06-15 12:54:46.456276,2025-06-15 12:56:08.357084,0 days 00:01:21.900808,False,13,0.5,1,4,315,COMPLETE
162,0.9201395359592313,2025-06-15 12:54:52.619950,2025-06-15 12:56:27.261964,0 days 00:01:34.642014,False,13,0.5,1,4,357,COMPLETE
163,0.9196052762794171,2025-06-15 12:54:53.504697,2025-06-15 12:56:08.742958,0 days 00:01:15.238261,False,14,0.5,1,4,284,COMPLETE
164,0.9200472125195386,2025-06-15 12:54:57.406701,2025-06-15 12:56:23.049245,0 days 00:01:25.642544,False,14,0.5,1,4,314,COMPLETE
165,0.919252323905609,2025-06-15 12:55:14.168716,2025-06-15 12:56:51.281741,0 days 00:01:37.113025,False,14,0.5,1,4,363,COMPLETE
166,0.9214215349808352,2025-06-15 12:55:38.335035,2025-06-15 12:57:02.217924,0 days 00:01:23.882889,False,14,0.5,1,4,315,COMPLETE
